<?xml version="1.0" encoding="UTF-8"?>
<!DOCTYPE simulation SYSTEM "simulation.dtd"> 
<simulation finalinst="100" initpop="10" maxpop="500" comfortsens="3"> 
   <grid colsnb="10" rowsnb="10"/> 
   <initialpoint xinitial="2" yinitial="1"/> 
   <finalpoint xfinal="10" yfinal="9"/>
   <specialcostzones num="1">
      <zone xinitial="8" yinitial="8" xfinal="5" yfinal="5">3</zone>
   </specialcostzones>
   <obstacles num="15">
      <obstacle xpos="1" ypos="5"/>
      <obstacle xpos="3" ypos="5"/>
      <obstacle xpos="4" ypos="5"/>
      <obstacle xpos="6" ypos="5"/>
      <obstacle xpos="6" ypos="4"/>
      <obstacle xpos="6" ypos="3"/>
      <obstacle xpos="6" ypos="2"/>
      <obstacle xpos="6" ypos="1"/>
      <obstacle xpos="6" ypos="8"/>
      <obstacle xpos="6" ypos="9"/>
      <obstacle xpos="6" ypos="10"/>
      <obstacle xpos="7" ypos="8"/>
      <obstacle xpos="9" ypos="8"/>
      <obstacle xpos="10" ypos="8"/>
   </obstacles>
   <events>
      <death param="10"/>
      <reproduction param="1"/>
      <move param="1"/>
   </events>
</simulation>

