<?xml version="1.0" encoding="UTF-8"?>
<!DOCTYPE simulation SYSTEM "simulation.dtd"> 
<simulation finalinst="100" initpop="10" maxpop="500" comfortsens="3"> 
   <grid colsnb="10" rowsnb="2"/> 
   <initialpoint xinitial="1" yinitial="1"/> 
   <finalpoint xfinal="10" yfinal="2"/>
   <obstacles num="5">
      <obstacle xpos="1" ypos="2"/>
      <obstacle xpos="3" ypos="1"/>
      <obstacle xpos="5" ypos="2"/>
      <obstacle xpos="7" ypos="1"/>
      <obstacle xpos="9" ypos="2"/>
   </obstacles>
   <events>
      <death param="10"/>
      <reproduction param="1"/>
      <move param="1"/>
   </events>
</simulation>